{"contract":"typaxis.machine-fixture-matrix/1","fixtures":[{"expected":"scenarios/diagnostics-max-plus-one/expected.json","fixture_id":"diagnostics.max-plus-one"},{"expected":"invalid/paragraph-1-table/expected.json","fixture_id":"paragraph-1.table-rejected"},{"expected":"scenarios/alias-race/expected.json","fixture_id":"publication.alias-race"},{"expected":"scenarios/partial-failure/expected.json","fixture_id":"publication.partial-failure"},{"expected":"scenarios/round-trip/expected.json","fixture_id":"round-trip.canonical"},{"expected":"scenarios/receipt-swap/expected.json","fixture_id":"tamper.receipt-swap"}],"profile":"typaxis.machine-pdf/paragraph-1","rows":[{"fixture_ids":["tamper.receipt-swap"],"id":"m1-closure-receipts","test":"machine_tests::receipt_sessions_are_not_interchangeable"},{"fixture_ids":["diagnostics.max-plus-one"],"id":"m1-closure-diagnostics","test":"machine_tests::command_diagnostic_budget_retains_primary_and_omission_note"},{"fixture_ids":["publication.alias-race"],"id":"m1-closure-aliases","test":"machine_tests::all_machine_targets_reject_input_aliases"},{"fixture_ids":["publication.partial-failure"],"id":"m1-closure-publication","test":"machine_tests::publication_failure_artifact_sets_are_typed"},{"fixture_ids":["round-trip.canonical"],"id":"m1-closure-round-trip","test":"machine_tests::canonical_round_trip_relations_hold"},{"fixture_ids":["paragraph-1.table-rejected"],"id":"m1-closure-paragraph-table-rejection","test":"machine_tests::machine_table_paragraph_profile_rejects_table"}],"verification_commands":["cargo test --manifest-path workspace/Cargo.toml --package typaxis-cli machine --locked","cargo test --manifest-path workspace/Cargo.toml --package typaxis-document-package --locked","python3 schemas/validate.py"]}