{"contract":"typaxis.machine-fixture-matrix/1","fixtures":[{"expected":"invalid/i9100-package-bytes-exact/expected.json","fixture_id":"i9100.package-bytes-exact"},{"expected":"invalid/i9100-package-bytes-max-plus-one/expected.json","fixture_id":"i9100.package-bytes-max-plus-one"},{"expected":"invalid/i9101-depth-exact/expected.json","fixture_id":"i9101.depth-exact"},{"expected":"invalid/i9101-depth-max-plus-one/expected.json","fixture_id":"i9101.depth-max-plus-one"},{"expected":"scenarios/i9110-host-unavailable/expected.json","fixture_id":"i9110.host-unavailable"},{"expected":"scenarios/i9111-package-symlink/expected.json","fixture_id":"i9111.package-symlink"},{"expected":"scenarios/i9112-source-symlink/expected.json","fixture_id":"i9112.source-symlink"},{"expected":"scenarios/i9113-package-mutation/expected.json","fixture_id":"i9113.package-mutation"},{"expected":"scenarios/i9113-source-mutation/expected.json","fixture_id":"i9113.source-mutation"},{"expected":"invalid/l5100-unsupported-content/expected.json","fixture_id":"l5100.unsupported.content"},{"expected":"invalid/l5101-unsupported-style-master/expected.json","fixture_id":"l5101.unsupported.style.master"},{"expected":"invalid/p1100-bom/expected.json","fixture_id":"p1100.bom"},{"expected":"invalid/p1100-nul/expected.json","fixture_id":"p1100.nul"},{"expected":"invalid/p1100-trailing-token/expected.json","fixture_id":"p1100.trailing.token"},{"expected":"invalid/p1101-duplicate-escaped-key/expected.json","fixture_id":"p1101.duplicate.escaped.key"},{"expected":"invalid/p1101-malformed-json/expected.json","fixture_id":"p1101.malformed.json"},{"expected":"invalid/p1102-float-integer/expected.json","fixture_id":"p1102.float.integer"},{"expected":"invalid/p1102-missing-field/expected.json","fixture_id":"p1102.missing.field"},{"expected":"invalid/p1102-range/expected.json","fixture_id":"p1102.range"},{"expected":"invalid/p1102-unknown-field/expected.json","fixture_id":"p1102.unknown.field"},{"expected":"invalid/p1103-unknown-contract/expected.json","fixture_id":"p1103.unknown-contract"},{"expected":"invalid/p1110-multiple-sources/expected.json","fixture_id":"p1110.multiple-sources"},{"expected":"invalid/p1110-nonzero-entry/expected.json","fixture_id":"p1110.nonzero-entry"},{"expected":"invalid/p1111-unsafe-source/expected.json","fixture_id":"p1111.unsafe-source"},{"expected":"invalid/p1112-identity-map/expected.json","fixture_id":"p1112.identity-map"},{"expected":"invalid/p1112-source-hash/expected.json","fixture_id":"p1112.source-hash"},{"expected":"invalid/p1112-source-length/expected.json","fixture_id":"p1112.source-length"},{"expected":"profiles/paragraph-1/blank-1.0/expected.json","fixture_id":"paragraph-1.blank-1.0"},{"expected":"profiles/paragraph-1/blank-1.1/expected.json","fixture_id":"paragraph-1.blank-1.1"},{"expected":"profiles/paragraph-1/blank-1.2/expected.json","fixture_id":"paragraph-1.blank-1.2"},{"expected":"profiles/paragraph-1/combined/expected.json","fixture_id":"paragraph-1.combined"},{"expected":"invalid/r7100-unsupported-image/expected.json","fixture_id":"r7100.unsupported.image"},{"expected":"scenarios/usage-package-outside-root/expected.json","fixture_id":"usage.package-outside-root"},{"expected":"scenarios/usage-unknown-profile/expected.json","fixture_id":"usage.unknown-profile"}],"profile":"typaxis.machine-pdf/paragraph-1","rows":[{"fixture_ids":["paragraph-1.blank-1.1"],"id":"m1-decoder-01","test":"machine_tests::matrix_01_blank_1_1"},{"fixture_ids":["paragraph-1.blank-1.0"],"id":"m1-decoder-02","test":"machine_tests::matrix_02_blank_1_0"},{"fixture_ids":["paragraph-1.combined"],"id":"m1-decoder-03","test":"machine_tests::matrix_03_combined"},{"fixture_ids":["p1100.bom","p1100.nul","p1100.trailing.token"],"id":"m1-decoder-04","test":"machine_tests::matrix_04_package_envelope"},{"fixture_ids":["p1101.malformed.json","p1101.duplicate.escaped.key"],"id":"m1-decoder-05","test":"machine_tests::matrix_05_json_grammar"},{"fixture_ids":["p1102.unknown.field","p1102.missing.field","p1102.float.integer","p1102.range"],"id":"m1-decoder-06","test":"machine_tests::matrix_06_typed_members"},{"fixture_ids":["p1103.unknown-contract"],"id":"m1-decoder-07","test":"machine_tests::matrix_07_unknown_contract"},{"fixture_ids":["i9100.package-bytes-exact","i9100.package-bytes-max-plus-one"],"id":"m1-decoder-08","test":"machine_tests::matrix_08_package_bytes"},{"fixture_ids":["i9101.depth-exact","i9101.depth-max-plus-one"],"id":"m1-decoder-09","test":"machine_tests::matrix_09_json_depth"},{"fixture_ids":["p1110.multiple-sources","p1110.nonzero-entry"],"id":"m1-decoder-10","test":"machine_tests::matrix_10_source_profile"},{"fixture_ids":["p1111.unsafe-source","i9112.source-symlink"],"id":"m1-decoder-11","test":"machine_tests::matrix_11_source_path"},{"fixture_ids":["usage.package-outside-root"],"id":"m1-decoder-12","test":"machine_tests::matrix_12_package_root"},{"fixture_ids":["i9111.package-symlink"],"id":"m1-decoder-13","test":"machine_tests::matrix_13_package_open"},{"fixture_ids":["p1112.source-length","p1112.source-hash"],"id":"m1-decoder-14","test":"machine_tests::matrix_14_source_identity"},{"fixture_ids":["i9113.package-mutation","i9113.source-mutation"],"id":"m1-decoder-15","test":"machine_tests::matrix_15_stable_read"},{"fixture_ids":["p1112.identity-map"],"id":"m1-decoder-16","test":"machine_tests::matrix_16_identity_map"},{"fixture_ids":["l5100.unsupported.content"],"id":"m1-decoder-17","test":"machine_tests::matrix_17_unsupported_content"},{"fixture_ids":["l5101.unsupported.style.master"],"id":"m1-decoder-18","test":"machine_tests::matrix_18_unsupported_style"},{"fixture_ids":["r7100.unsupported.image"],"id":"m1-decoder-19","test":"machine_tests::matrix_19_unsupported_image"},{"fixture_ids":["i9110.host-unavailable"],"id":"m1-decoder-20","test":"machine_tests::matrix_20_host_unavailable"},{"fixture_ids":["usage.unknown-profile"],"id":"m1-decoder-21","test":"machine_tests::matrix_21_unknown_profile"},{"fixture_ids":["paragraph-1.blank-1.2"],"id":"m1-decoder-22","test":"machine_tests::matrix_22_blank_1_2"}],"verification_commands":["cargo test --manifest-path workspace/Cargo.toml --package typaxis-cli machine --locked","cargo test --manifest-path workspace/Cargo.toml --package typaxis-document-package --locked","python3 schemas/validate.py"]}